PROLIFIC_PID,Facebook,Facebook_freq,Instagram,Instagram_freq,TV news programs,TV news programs_freq,TikTok,TikTok_freq,Twitter/X,Twitter/X_freq,YouTube,YouTube_freq,online news sites,online news sites_freq,podcasts,podcasts_freq,printed newspapers,printed newspapers_freq,the radio,the radio_freq
5a09ebdf087f2e0001eae39f,KFYR,Daily,MEATEATER,Weekly,,Less than monthly / Never,,Less than monthly / Never,,Less than monthly / Never,,Less than monthly / Never,WYMT: WVLT; KFYR,Monthly,,Less than monthly / Never,,Less than monthly / Never,the local radio stations ,Weekly
6449b6ac80df4eb6727b570c,,Less than monthly / Never,,Less than monthly / Never,"Fox and Friends; The Faulkner Focus; Outnumbered; The Five; The Ingraham Angle; Jesse Watters Primetime; Hannity, Gutfeld; Kudlow",Multiple times per day,,Less than monthly / Never,Breitbart; NY Post; Matt Wallace; Jonathan Turley; Collin Rugg; Ted Cruz,Multiple times per day,The Dershow With Alan Dershowitz; Russell Brand; Tucker Carlson,Daily,"foxnews.com; breitbart.com; thegatewaypundit.com, thepostmillenial.com; nypost.com; yahoo.com",Multiple times per day,The Joe Rogan Experience,Weekly,,Less than monthly / Never,The Glen Beck Show; The Clay Travis and Buck Sexton Show; The Sean Hannity Show,Multiple times per day
627286792f25495f123cc27b,,Less than monthly / Never,,Less than monthly / Never,,Less than monthly / Never,,Less than monthly / Never,Glen Greenwald; Matt Tiabi; Jim Cantore; zerohedge; Tom Elliott,Multiple times per day,Al Jazeera English; Barstool Sports; Breaking points: Eric Berg,Daily,reuters.com; dw.com; bbc.uk; nypost.com,Weekly,Joe Rogan; Patrick Bet-David; Peter Schiff; Ron Paul,Weekly,,Less than monthly / Never,,Less than monthly / Never
5c3e82e91580e9000122d204,,Less than monthly / Never,,Less than monthly / Never,,Less than monthly / Never,,Less than monthly / Never,,Less than monthly / Never,,Less than monthly / Never,CNN; NPR,Weekly,,Less than monthly / Never,,Less than monthly / Never,,Less than monthly / Never
612146069bb6dfc53b730795,randomly shows up on my feed,Monthly,,Less than monthly / Never,,Less than monthly / Never,usually on my FY page videos will show up if im interested i will go to goggle and search for the news stories,Weekly,,Less than monthly / Never,,Less than monthly / Never,if i find a story i am intested in i will usually watch the top rated ones on a google search not a specific source,Monthly,,Less than monthly / Never,,Less than monthly / Never,,Less than monthly / Never
5deaa726df55eb1cc1b9474f,,Less than monthly / Never,Occupy Democrats,Weekly,MSNBC; NBC; ABC,Multiple times per day,,Less than monthly / Never,,Less than monthly / Never,MSNBC; NBC; Brian Taylor Cohen,Multiple times per day,NYT; NPR; AP; Politico,Multiple times per day,Brian Taylor Cohen; MeidasTouch,Weekly,,Less than monthly / Never,,Less than monthly / Never
60fde74940100db428b34a06,,Less than monthly / Never,,Less than monthly / Never,NBC,Weekly,What happened today; news under the desk ,Daily,,Less than monthly / Never,,Less than monthly / Never,"Yahoo, Google, CNBC",Daily,NPR,Monthly,,Less than monthly / Never,,Less than monthly / Never
588caba9ca4f6700019cfafc,,Less than monthly / Never,,Less than monthly / Never,,Less than monthly / Never,,Less than monthly / Never,barstool sports,Monthly,nbc sports; abc news; npr; vice; nbc news ,Multiple times per day,new york times; washington post,Multiple times per day,the daily; this american life,Daily,,Less than monthly / Never,,Less than monthly / Never
5a6d3a19e6cc4a0001b6c47a,,Less than monthly / Never,,Less than monthly / Never,"CNBC, local news 12",Daily,,Less than monthly / Never,,Less than monthly / Never,,Less than monthly / Never,yahoo; msn; cnn,Daily,,Less than monthly / Never,wall street journal; USA today,Monthly,,Less than monthly / Never
60c3ba02dfcf64dbe7ae0396,,Less than monthly / Never,,Less than monthly / Never,,Less than monthly / Never,,Less than monthly / Never,,Weekly,Philip DeFranco,Daily,,Less than monthly / Never,,Less than monthly / Never,,Less than monthly / Never,,Less than monthly / Never
660ac226bf9dc033129579ab,Local weather. ABC news,Daily,,Less than monthly / Never,,Less than monthly / Never,,Less than monthly / Never,,Less than monthly / Never,,Less than monthly / Never,Local weather,Daily,,Less than monthly / Never,,Less than monthly / Never,,Less than monthly / Never
620299a8ef1cb18a1337c4d1,,Less than monthly / Never,,Less than monthly / Never,ABC news; local news; and FOX,Daily,,Less than monthly / Never,WAPO; NYT; osintdefender; breaking911,Multiple times per day,,Less than monthly / Never,nyt; wapo; courier-journal,Daily,,Less than monthly / Never,,Less than monthly / Never,WHAS local news on the hour,Daily
6318be45a49442eee3a88cb3,Friends; Family,Daily,,Less than monthly / Never,Fox News; CNN; CBS local news,Multiple times per day,,Less than monthly / Never,Elon Musk; CBS local channel; Fix News; CNN; Friends; Family,Multiple times per day,Pinball Preparedness; The Poplar Report; Alaska Prepper; Appalachia's Homestead,Daily,"CBS local news, CNN; Fox News",Weekly,,Less than monthly / Never,,Less than monthly / Never,,Less than monthly / Never
63e5517cd738b83025348a43,,Less than monthly / Never,,Less than monthly / Never,NBC NIghtly News; MSNBC - Deadline White House; MSNBC Chris Hayes; MSNBC Alex Wagner,Multiple times per day,,Less than monthly / Never,Joe Biden; Sherrod Brown; MSNBC,Weekly,,Less than monthly / Never,,Less than monthly / Never,,Less than monthly / Never,,Less than monthly / Never,,Less than monthly / Never
63c0b8e25159ad47312132ac,CNBC; CNN,Weekly,,Less than monthly / Never,WIS News 10; WNSC-TV,Weekly,,Less than monthly / Never,Fox News; CNN,Weekly,CNN,Weekly,CNBC; CNN ; GOOGLE NEWS,Monthly,,Less than monthly / Never,The State; Aiken Standard ,Weekly,,Less than monthly / Never
6568b0b4e9cc3024c09286f9,,Less than monthly / Never,,Less than monthly / Never,CBS; NPR; CNN,Multiple times per day,,Less than monthly / Never,,Less than monthly / Never,,Less than monthly / Never,Apple News,Multiple times per day,Meidas Touch,Daily,,Less than monthly / Never,,Less than monthly / Never
62f269f2a7751126ffb96a4c,,Less than monthly / Never,,Less than monthly / Never,,Less than monthly / Never,,Less than monthly / Never,,Less than monthly / Never,,Less than monthly / Never,,Less than monthly / Never,,Less than monthly / Never,,Less than monthly / Never,,Less than monthly / Never
5dc0a5b5b4cc78050437f1b4,,Less than monthly / Never,,Less than monthly / Never,"CNN, Fox, ",Monthly,,Less than monthly / Never,,Less than monthly / Never,,Less than monthly / Never,"Newsbreak, ",Weekly,,Less than monthly / Never,,Less than monthly / Never,Local radio stations ,Weekly
628f700669d5f6e4e33c8d8e,,Less than monthly / Never,,Less than monthly / Never,,Daily,,Less than monthly / Never,,Less than monthly / Never,,Less than monthly / Never,,Less than monthly / Never,,Less than monthly / Never,,Daily,,Less than monthly / Never
6643dcbef572827cc37440d3,"CityofFarmingtonNM, FDTNews",Weekly,,Less than monthly / Never,,Less than monthly / Never,,Less than monthly / Never,,Less than monthly / Never,,Less than monthly / Never,"Reddit, specifically the Front page and News sections",Daily,,Less than monthly / Never,,Less than monthly / Never,,Less than monthly / Never
66045425bc6536ec4ac1555a,,Less than monthly / Never,,Less than monthly / Never,"CNN, MSNBC, Fox",Monthly,,Less than monthly / Never,Pew,Monthly,MSNBC,Monthly,"Bloomberg, Fortune, Psychology Today, AP",Weekly,"Dateline, Various true crime",Weekly,,Less than monthly / Never,,Less than monthly / Never
64136fca174b34ba3a481cfd,Abc;newsbreak,Weekly,,Less than monthly / Never,Cnn;abc;nbc,Weekly,,Less than monthly / Never,,Less than monthly / Never,,Less than monthly / Never,Abc; politico,Monthly,The daily; abc news daily; on point,Weekly,Telegraph Harold ,Weekly,,Less than monthly / Never
63e55808e2a9efc0cd65e879,,Less than monthly / Never,,Less than monthly / Never,Fox news,Daily,,Less than monthly / Never,,Less than monthly / Never,,Less than monthly / Never,,Less than monthly / Never,,Less than monthly / Never,,Less than monthly / Never,,Less than monthly / Never
6466252fc70d9bdc95aa26fd,,Daily,,Less than monthly / Never,,Daily,,Less than monthly / Never,,Less than monthly / Never,,Weekly,"New York Times, huff post, press rundown, NewsBreak Allegan, Washington post",Multiple times per day,,Less than monthly / Never,,Less than monthly / Never,,Less than monthly / Never
63386e75b02c4d7013c1198b,,Less than monthly / Never,,Less than monthly / Never,,Less than monthly / Never,,Less than monthly / Never,Elon Musk only,Weekly,"Tim Pool, Jordan Peterson, Patriot Twins, PBS",Multiple times per day,,Less than monthly / Never,,Less than monthly / Never,,Less than monthly / Never,,Less than monthly / Never
62e9c91168f8d1ff048964e9,,Less than monthly / Never,,Less than monthly / Never,WGAL,Weekly,,Less than monthly / Never,,Less than monthly / Never,,Less than monthly / Never,Fox news: smart News,Daily,,Less than monthly / Never,,Less than monthly / Never,FOX NEWS,Monthly
5dd78dc3238a9171fbd93f22,,Less than monthly / Never,,Less than monthly / Never,"i watch local news thru youtube, ",Daily,,Less than monthly / Never,,Less than monthly / Never,i only watch certain stories,Weekly,thru the websites of newspapers or local tv stations,Monthly,,Less than monthly / Never,i will go to news paper websites does that count?,Weekly,,Less than monthly / Never
6630f0dc60e431bb28ab7e31,,Less than monthly / Never,,Less than monthly / Never,"local news broadcast, fox 5 atlanta",Weekly,,Less than monthly / Never,,Less than monthly / Never,"ryan hall, ap, atlanta first",Weekly,"yahoo news, huffington post, nyt",Daily,,Less than monthly / Never,"gainesville times, ajc",Monthly,,Less than monthly / Never
6630c32c655e37e8b8d59960,Millis public forum,Weekly,,Less than monthly / Never,"CNN, FOX, MSNBC, Channel 5",Monthly,"not sure, just depends who comes up on my FYP",Weekly,,Less than monthly / Never,,Less than monthly / Never,,Less than monthly / Never,,Less than monthly / Never,,Less than monthly / Never,,Less than monthly / Never
63b73bd5a6179e2e7297d96e,,Less than monthly / Never,Stories shared by my politically active friends,Daily,,Less than monthly / Never,,Less than monthly / Never,,Less than monthly / Never,,Less than monthly / Never,,Less than monthly / Never,,Less than monthly / Never,,Less than monthly / Never,,Less than monthly / Never
65b55f63190746b1c9c19e29,,Less than monthly / Never,,Less than monthly / Never,Presently: NBC Nightly News; Sky News; Local TV; Reuters. Formerly: CNN; Fox,Daily,,Less than monthly / Never,"Random. If something pops up that is important, I'll look elsewhere for information.",Daily,,Less than monthly / Never,CNN; Detroit Free Press; News Aggregator; CBC; BBC; The Guardian; Times of India; The Globe and Mail; The Economist.; etc.,Multiple times per day,,Less than monthly / Never,Mostly local news: Grosse Pointe News; Grosse Pointe Times; Detroit Metro Times; Detroit Free Press,Weekly,Detroit PBS; CBC;,Weekly
65980f73048d02626828cd2c,My friends profiles,Monthly,,Less than monthly / Never,,Less than monthly / Never,,Less than monthly / Never,,Less than monthly / Never,Prophet Lovy's official page,Monthly,Bored Panda website,Daily,,Less than monthly / Never,,Less than monthly / Never,,Less than monthly / Never
63df41179d1e6352b228a74f,On my newsfeed,Daily,,Less than monthly / Never,,Less than monthly / Never,,Less than monthly / Never,,Less than monthly / Never,"Abcnews; louder wirh crowder; joe rogan; run, dont walk",Monthly,,Less than monthly / Never,,Less than monthly / Never,,Less than monthly / Never,Kduc; ,Daily
62c345831d3aed7142af2c6f,,Less than monthly / Never,,Less than monthly / Never,WCCO; CNN,Weekly,,Less than monthly / Never,Start Tribune; Paul Douglas; KFAN; Ukraine Independent ,Weekly,,Less than monthly / Never,Apple News; NYT; Washington Post; Star Tribune,Daily,,Less than monthly / Never,Star Tribune ,Weekly,WCCO ,Multiple times per day
6503144f9a10397111eb3eb9,Newsfeed,Daily,,Less than monthly / Never,MSNBC; Fox; CNBC,Daily,,Less than monthly / Never,NPR; CNN; Fox: Tucker Carlson; New York Times,Multiple times per day,,Less than monthly / Never,The New York Times; Google News; Fox News; The Washington Post; NPR,Multiple times per day,All-In; Freakonomics; NPR,Daily,The Villages Daily Sun,Weekly,WDBO; WRKO,Multiple times per day
644857a2d21eca3ffb31101e,CNN ; BBC World News ;MSNBC  ; NBC; ABC; CBS,Daily,CNN ; BBC World News ;MSNBC  ; NBC; ABC; CBS,Weekly,Fox San Antonio; BBC World News; WAI-TV,Daily,CNN ; BBC World News ;MSNBC ;CBS,Weekly,CNN ; BBC World News ;MSNBC  ; NBC; ABC; CBS,Daily,,Less than monthly / Never,BBC World News; Fox News; MSNBC; NBC; ABC; CBS,Daily,,Less than monthly / Never,San Antonio Express-News,Daily,WOAI ; KSTX,Daily
5db4ef4a2986a3000be1f886,,Less than monthly / Never,,Less than monthly / Never,MSNBC; ABC; CBS; NBC; NPR; AP Wire; Reuters,Daily,,Less than monthly / Never,,Less than monthly / Never,MSNBC; CBS; ABC; NBC; Meidas Touch Network; NPR; AP Wire; Reuters,Multiple times per day,,Less than monthly / Never,The Rant; Altcoin Daily,Weekly,new york times; wall street journal; washington post,Weekly,,Less than monthly / Never
60f315a05d516a5bc9db732c,,Less than monthly / Never,,Less than monthly / Never,"CNN, ABC local network and ABC World News Tonight",Daily,,Less than monthly / Never,,Less than monthly / Never,,Less than monthly / Never,MSN,Multiple times per day,NPR The Daily,Weekly,,Less than monthly / Never,NPR,Weekly
63cc90d2bed7edb18c3fd155,,Less than monthly / Never,,Less than monthly / Never,cnn,Monthly,,Less than monthly / Never,,Less than monthly / Never,"CNN, MSNBC, Breaking Points, TYT, Meidas Touch",Daily,"BBC News, the Guardian, WaPo",Monthly,,Less than monthly / Never,,Less than monthly / Never,,Less than monthly / Never
6644c7f5c804fc312d797069,"Promoted posts, others posting new on the page",Daily,Links from different groups NPR/NYT etc. peoples story links as well,Multiple times per day,,Less than monthly / Never,"Mostly people reporting based off of AP articles, daily mail, NYT, etc",Multiple times per day,,Less than monthly / Never,,Less than monthly / Never,,Less than monthly / Never,The Daily ,Daily,,Less than monthly / Never,,Less than monthly / Never
659ffc7d7d21a61dbc761173,,Less than monthly / Never,,Less than monthly / Never,"newsmax, real America's voice ",Daily,,Less than monthly / Never,,Less than monthly / Never,,Less than monthly / Never,,Less than monthly / Never,,Less than monthly / Never,,Less than monthly / Never,,Less than monthly / Never
5d9b7f29654a3102c8112b63,,Less than monthly / Never,,Less than monthly / Never,,Daily,,Less than monthly / Never,,Less than monthly / Never,,Less than monthly / Never,,Less than monthly / Never,Joe Rogan,Weekly,,Less than monthly / Never,,Less than monthly / Never
5d4313562b1b2700163e15e2,,Less than monthly / Never,,Less than monthly / Never,CNN; BBC,Weekly,,Less than monthly / Never,NY Times; Reuters,Daily,CNN; NY Times; BBC News,Weekly,NY Times; NPR; Google News,Daily,NPR; NY Times Book Review; Daily News Tech Show,Daily,,Less than monthly / Never,NPR,Weekly
662a650b6b7d15a354343ad4,,Less than monthly / Never,,Less than monthly / Never,"CNN, BBC, MSNBC",Daily,,Less than monthly / Never,CNN; NPR; NBC; REUTERS; NYT; BBC WORLD,Weekly,,Less than monthly / Never,Apple News; NPR; BBC; WSJ; Washington Post,Daily,,Less than monthly / Never,New York Times,Weekly,NPR,Daily
63cac85f8519383ef0422593,,Less than monthly / Never,,Less than monthly / Never,"Fox News, BBC",Weekly,,Less than monthly / Never,,Less than monthly / Never,,Less than monthly / Never,"Google, FOx",Multiple times per day,,Less than monthly / Never,,Less than monthly / Never,,Less than monthly / Never
661af8122dccbc14bf165614,Unfiltered With Kiran,Daily,,Less than monthly / Never,WAFB news; WBRZ news; Fox News; CNN; WVLA News,Daily,,Less than monthly / Never,,Less than monthly / Never,,Less than monthly / Never,Unfiltered with Kiran; Fox News; WAFB News,Daily,Unfiltered with Kiran; Real Life Real Crime,Daily,,Less than monthly / Never,WJBO Talk Radio,Weekly
5d462cd2638dca0001daa57c,,Less than monthly / Never,,Less than monthly / Never,,Less than monthly / Never,,Less than monthly / Never,I just follow Palestine accounts and look at thre trending tab,Daily,Cnn,Monthly,,Less than monthly / Never,,Less than monthly / Never,,Less than monthly / Never,,Less than monthly / Never
5e84f59e965b290c42fad433,,Less than monthly / Never,,Less than monthly / Never,,Less than monthly / Never,,Less than monthly / Never,ettingermentum;clairepenis,Multiple times per day,,Less than monthly / Never,,Less than monthly / Never,,Less than monthly / Never,,Less than monthly / Never,,Less than monthly / Never
652d7f42ece5cec67355a4b8,,Less than monthly / Never,,Less than monthly / Never,"CNN - news ; ABC - news, 20/20, documentary type features ",Multiple times per day,,Less than monthly / Never,,Less than monthly / Never,Re-broadcast of some current news,Monthly,Samsunh News; Google News,Multiple times per day,,Less than monthly / Never,,Less than monthly / Never,10/10 WINS,Daily
627b5aecd9b0673d05d2de9c,,Less than monthly / Never,,Less than monthly / Never,,Less than monthly / Never,,Less than monthly / Never,,Less than monthly / Never,I mostly watch videos about games examples include Minecraft ; Genshin Impact ; Wuthering Waves.  Otherwise I watch commentary videos talking about different subjects.,Monthly,,Less than monthly / Never,,Less than monthly / Never,,Less than monthly / Never,,Less than monthly / Never
56d1af6521cd29000b973ff2,,Less than monthly / Never,,Less than monthly / Never,Fox News,Multiple times per day,,Less than monthly / Never,,Less than monthly / Never,,Less than monthly / Never,Fox News,Daily,,Less than monthly / Never,Fox News,Multiple times per day,,Less than monthly / Never
5ee3c01c7247c006e9a3f4fd,,Less than monthly / Never,,Less than monthly / Never,CNN; ABC; News Nation,Multiple times per day,,Less than monthly / Never,,Less than monthly / Never,,Less than monthly / Never,CNN.com; ABC.com; USAToday.com,Multiple times per day,,Less than monthly / Never,,Less than monthly / Never,NPR,Daily
656de95d96d9c1b0bfa2ba83,,Less than monthly / Never,,Less than monthly / Never,,Less than monthly / Never,,Less than monthly / Never,,Less than monthly / Never,Local first coast news in Florida: Jax News 4 Live,Multiple times per day,,Less than monthly / Never,,Less than monthly / Never,,Less than monthly / Never,,Less than monthly / Never
60477705b440ae26c4aaf5bb,,Less than monthly / Never,,Less than monthly / Never,NBC Nightly News; MSNBC,Weekly,,Less than monthly / Never,YNet; NBC; Retro RGB; OSINTechnical,Daily,PBS News Hour,Weekly,Washington Post; Wallstreet Journal; Ynet; Mako.co.il; New York Times,Multiple times per day,Times of Israel; NPR,Daily,New York Times; Washington Post; Wall Street Journal,Daily,NPR,Daily
571164253d47e80009635a80,,Less than monthly / Never,"Any ""local"" news that pops up when I am scrolling.  I do not use Instagram as a choice for national news.",Weekly,ABC Nightly News and/or NBC Nightly News; MSNBC; CNN; ABC; NBC; and CBS LOCAL news affiliates; Hallie Jackson streaming; Haystack News streaming,Multiple times per day,,Less than monthly / Never,,Less than monthly / Never,ABC; NBC; CBS,Weekly,Washington Post; CNN; USA Today; NPR; Reuters; Pensacola News Journal,Multiple times per day,,Less than monthly / Never,,Less than monthly / Never,,Less than monthly / Never
612b86da38f96808af7bb1da,,Less than monthly / Never,,Less than monthly / Never,,Daily,,Less than monthly / Never,,Less than monthly / Never,,Less than monthly / Never,,Less than monthly / Never,,Less than monthly / Never,,Less than monthly / Never,,Less than monthly / Never
5c101f812a1a620001f04007,,Less than monthly / Never,,Less than monthly / Never,ABC news,Daily,,Less than monthly / Never,,Less than monthly / Never,,Less than monthly / Never,Gateway Pundit; Conservative Treehouse; Breitbart,Monthly,,Less than monthly / Never,,Less than monthly / Never,,Less than monthly / Never
60b4277a6c6540693acdd766,Huffington Post; MSNBC; PennLive,Daily,,Less than monthly / Never,Today Show; Morning Joe; Deadline White House; WGAL News,Daily,,Less than monthly / Never,,Less than monthly / Never,,Less than monthly / Never,PennLive,Daily,,Less than monthly / Never,,Less than monthly / Never,Fresh Air; Marketplace,Weekly
64a2be5c2053c3002cf8bbfc,Newsmax nation,Monthly,,Less than monthly / Never,Newsmax ; Fox News,Multiple times per day,,Less than monthly / Never,,Less than monthly / Never,,Less than monthly / Never,WAVY : WTKR ; 13NEWSNOW,Daily,,Less than monthly / Never,,Less than monthly / Never,,Less than monthly / Never
65e10c42110a19db34d6c99f,"BBC, Al-Jazeera and Only in Illinois ",Daily,"The Daily Illini, University of Chicago",Multiple times per day,World News on BBC,Daily,,Less than monthly / Never,Illinois State,Daily,,Less than monthly / Never,BBC Online,Weekly,,Less than monthly / Never,,Less than monthly / Never,,Less than monthly / Never
6635271e50a53b7e3827a433,News Feed,Monthly,Instagram's Explore page,Monthly,BBC;CNN,Monthly,Tiktok's Spotlight page,Monthly,Twitter hashtags,Monthly,YouTube's Spotlight section,Monthly,Updates on online sites,Monthly,Topics on podcasts,Monthly,newstand; convenience stores,Monthly,National Public Radio; BBC world service ,Monthly
636578c6aa1228f8b15ee701,,Weekly,,Multiple times per day,CNN,Monthly,,Multiple times per day,,Weekly,,Weekly,,Monthly,,Less than monthly / Never,,Less than monthly / Never,,Weekly
660df062b833ef9ddc64276a,,Less than monthly / Never,,Less than monthly / Never,msnbc;cbs,Daily,,Less than monthly / Never,joe biden,Monthly,,Less than monthly / Never,smartnews; news; NBC news; BuzzFeed; NewsToday,Daily,badtv,Monthly,tampa tribune; usa today; newsbreak,Daily,,Less than monthly / Never
637ce608b8f8f923bf784d84,local groups,Multiple times per day,Lex18news: wkytnews,Weekly,,Less than monthly / Never,,Less than monthly / Never,,Less than monthly / Never,random shorts and posts; The View; CBS; ABC; NBC,Multiple times per day,SmartNews app,Daily,Citizen McCain,Monthly,,Less than monthly / Never,,Less than monthly / Never
663401ce98e411fda23aede9,News sites,Daily,,Less than monthly / Never,News channels,Weekly,,Less than monthly / Never,,Less than monthly / Never,,Less than monthly / Never,Fox news,Weekly,,Less than monthly / Never,,Less than monthly / Never,,Less than monthly / Never
6630fcae418bde6a9e7c3b47,,Less than monthly / Never,,Less than monthly / Never,"CNN, ABC",Monthly,,Less than monthly / Never,,Less than monthly / Never,,Less than monthly / Never,"Reddit posts that link to other news sources like NY TImes, Reuters, Bloomberg, etc.",Daily,,Less than monthly / Never,,Less than monthly / Never,,Less than monthly / Never
60002c38af716201edc1763d,,Less than monthly / Never,,Less than monthly / Never,"CNN, MSNBC, Reuters",Weekly,,Less than monthly / Never,,Less than monthly / Never,CNN;MSNBC;Reuters,Multiple times per day,,Less than monthly / Never,,Less than monthly / Never,,Less than monthly / Never,NPR,Weekly
66393f7fa489dc788f35845b,"Suggested posts tend to just pop up, or my friends will re-share news articles from different sites/sources",Weekly,"Again, I don't follow set accounts, the algorithm tends to pop things up, or I look at what my friends repost on stories. The most I can think of is Mitu",Daily,"Univision, ABC, CNN, ",Monthly,,Weekly,"NY Times, retweets by other users, there's no set accounts I follow, the algorithm tends to just pop them up for me.",Weekly,,Less than monthly / Never,"New York Times, Inside Higher Ed, Apple News",Monthly,,Less than monthly / Never,,Less than monthly / Never,,Less than monthly / Never
6488eb2841a2c8ae8a7776ab,,Less than monthly / Never,,Less than monthly / Never,ABC news; Fox News,Daily,,Less than monthly / Never,,Less than monthly / Never,Glenn Beck Specials; Tucker Carlson; Mark Levin;Megyn Kelley ,Multiple times per day,,Less than monthly / Never,Glenn Beck ,Daily,,Less than monthly / Never,,Less than monthly / Never
65a2cd1b1d1724a7eba41cd3,main page on Facebook,Daily,,Less than monthly / Never,abc; nbc; cbs; fox; and you tube,Multiple times per day,,Less than monthly / Never,lookner,Daily,ny prepper,Daily,drudge; daily mail online,Daily,,Less than monthly / Never,"wall street journal, new York times",Daily,the whale 101.2 fm,Daily
62d43bf9cb693bf6980c5ea9,,Less than monthly / Never,,Less than monthly / Never,,Less than monthly / Never,,Less than monthly / Never,,Less than monthly / Never,,Less than monthly / Never,NYT,Daily,,Less than monthly / Never,"NPR. BBC radio, NYT",Multiple times per day,"NPR, BBC radio",Multiple times per day
5e9f877ee0b0960f3d2b6d30,,Less than monthly / Never,,Less than monthly / Never,,Less than monthly / Never,,Less than monthly / Never,Twitter's trending page,Monthly,The daily show,Weekly,"Google News, CNN, NBC, The New York Times, Washington Post, CNBC, NPR, AP",Multiple times per day,,Less than monthly / Never,,Less than monthly / Never,,Less than monthly / Never
64527c12fe9ceb65346c27bf,Wall street journal,Daily,The wall street journal,Daily,Carolina outdoor journal,Weekly,sky sports,Daily,,Daily,Washington post,Weekly,,Less than monthly / Never,,Less than monthly / Never,The Charlotte observer.,Weekly,,Less than monthly / Never
65e1e10fd349a80ffaf53948,,Less than monthly / Never,,Less than monthly / Never,,Less than monthly / Never,,Less than monthly / Never,,Less than monthly / Never,,Less than monthly / Never,,Less than monthly / Never,,Less than monthly / Never,,Less than monthly / Never,,Weekly
