PROLIFIC_PID,Facebook,Facebook_freq,Instagram,Instagram_freq,TV news programs,TV news programs_freq,TikTok,TikTok_freq,Twitter/X,Twitter/X_freq,YouTube,YouTube_freq,online news sites,online news sites_freq,podcasts,podcasts_freq,printed newspapers,printed newspapers_freq,the radio,the radio_freq
5beddd59e4dbf300011c1d50,Music and film news from bands and movie/show pages that I follow like The Black Keys; Meshuggah,Daily,Entertainment news from actors and content creators that I follow like Arnold; Sly,Weekly,,Less than monthly / Never,,Less than monthly / Never,I check out some of what is trending and get entertainment news from figures that I follow like Arnold.,Daily,Various and political news from The Majority Report; TYT; David Pakman,Multiple times per day,Entertainment news like MovieWeb; Reddit,Daily,Entertainment news from various content creators like Alanah Pearce,Weekly,,Less than monthly / Never,NPR,Monthly
58f10e9305389a0001f99fc0,,Less than monthly / Never,,Less than monthly / Never,,Less than monthly / Never,,Less than monthly / Never,"Not specific, just when it pops up from people I follow",Daily,,Less than monthly / Never,"New York Times, Los Angeles Times, ABC 7, KCAL, BBC, ",Weekly,,Less than monthly / Never,,Less than monthly / Never,,Less than monthly / Never
5dd7b300a71de875640dc574,,Less than monthly / Never,,Less than monthly / Never,,Less than monthly / Never,,Less than monthly / Never,,Less than monthly / Never,CNN,Daily,Google News; Yahoo News,Multiple times per day,,Less than monthly / Never,,Less than monthly / Never,,Less than monthly / Never
5fffa12245970b114cb107af,,Less than monthly / Never,NBA; Sportscenter; ,Weekly,,Less than monthly / Never,,Weekly,,Less than monthly / Never,,Weekly,,Less than monthly / Never,,Less than monthly / Never,New York TImes; CNN,Monthly,,Less than monthly / Never
60c6e79ffd3d9bf1a7fc4f3e,,Less than monthly / Never,,Less than monthly / Never,,Less than monthly / Never,Philip DeFranco ,Monthly,New York times; Washington Post,Monthly,,Less than monthly / Never,,Less than monthly / Never,,Less than monthly / Never,,Less than monthly / Never,,Less than monthly / Never
6639bc448033a441fd301e89,,Less than monthly / Never,,Less than monthly / Never,,Less than monthly / Never,,Less than monthly / Never,,Less than monthly / Never,"CNN, ABC, NBC",Monthly,"CNN, BBC, AP, NPR, Eurosport",Multiple times per day,,Less than monthly / Never,,Less than monthly / Never,,Less than monthly / Never
5f231fd28626c50a0512ad14,,Less than monthly / Never,,Less than monthly / Never,Fox News,Daily,,Less than monthly / Never,Michael Knowles,Daily,Michael Knowles,Daily,New York Post; MSNBC,Weekly,Michael Knowles; Joe Rogan,Daily,Local newspaper; Wall Street Journal,Weekly,,Less than monthly / Never
5ba16cc388ec69000112a59b,,Less than monthly / Never,,Less than monthly / Never,,Less than monthly / Never,,Less than monthly / Never,,Less than monthly / Never,,Less than monthly / Never,NPR; CNN; Buzzfeed,Weekly,,Less than monthly / Never,,Less than monthly / Never,,Less than monthly / Never
664cf1914f41867dc91f9cce,,Daily,,Daily,,Daily,,Less than monthly / Never,,Multiple times per day,,Weekly,,Weekly,,Weekly,,Weekly,,Weekly
6632c0cfd2c9edde493e0c4b,Gistreel;legitnews;BBCnews,Daily,Tundednut;Arisetv,Daily,,Less than monthly / Never,,Less than monthly / Never,Lindanews,Weekly,BBCnews,Weekly,,Less than monthly / Never,,Less than monthly / Never,,Less than monthly / Never,,Less than monthly / Never
663282cdd80779eca86e436d,,Multiple times per day,,Weekly,,Multiple times per day,,Multiple times per day,,Multiple times per day,,Multiple times per day,,Multiple times per day,,Weekly,,Daily,,Multiple times per day
66410da1ad936cfe4f145774,facebook,Daily,fox news,Daily,cnn,Weekly,fox news,Daily,bbc or cnn,Daily,new york times,Weekly,cnn,Daily,,Monthly,newyork times,Weekly,kstv-fm,Daily
607dc630d2d30aa7e8699c23,,Less than monthly / Never,,Less than monthly / Never,"CNN, ABC, local news ",Monthly,,Less than monthly / Never,BBC; CNN; ABC; various twitter users,Daily,CNN; NBC; ABC; John Oliver; Jon Stewart,Daily,New York Times; CNN; NBC; ABC,Weekly,,Less than monthly / Never,,Less than monthly / Never,,Less than monthly / Never
5ca1b03f2461ab0017c413e7,newsfeeds,Daily,,Less than monthly / Never,abc msnbc,Daily,,Less than monthly / Never,,Less than monthly / Never,streaming from varoius channels,Daily,Yahoo MSNBC,Daily,,Less than monthly / Never,washington post,Weekly,,Less than monthly / Never
60cefee15b44bd17785295f1,,Less than monthly / Never,,Less than monthly / Never,,Daily,,Less than monthly / Never,,Less than monthly / Never,,Less than monthly / Never,cnn; bbc; fox news,Daily,,Less than monthly / Never,,Less than monthly / Never,npr,Daily
6622802c65f21d22cf06a47d,BBC NEWS,Daily,,Less than monthly / Never,ACTION NEWS,Daily,CNN,Daily,THE WASHINGTON POST,Daily,NEWYORK TIMES,Multiple times per day,THE GUARDIAN,Weekly,UP FIRST,Monthly,DETROIT FREE PRESS,Monthly,WWJ MORNING NEWS,Weekly
664982e011b1372fe674ba56,,Multiple times per day,,Multiple times per day,,Weekly,,Less than monthly / Never,,Less than monthly / Never,,Weekly,Fox;CNN;other major news outlets usually google recommended ,Daily,,Less than monthly / Never,,Less than monthly / Never,,Weekly
663e2b925ada651767651ef2,,Daily,,Daily,,Daily,,Daily,,Daily,,Daily,,Daily,,Daily,,Daily,,Daily
62fbb29b2ed8224d75d7357f,,Less than monthly / Never,Some advocates that I follow regarding the social issues I care about. They repost reels and news articles,Multiple times per day,,Less than monthly / Never,,Less than monthly / Never,,Less than monthly / Never,Vox; BBC; LA Times; The Daily Show,Multiple times per day,,Less than monthly / Never,Marketplace,Weekly,,Less than monthly / Never,,Less than monthly / Never
650c35afef9d824f88426c36,,Less than monthly / Never,,Less than monthly / Never,,Less than monthly / Never,"First witness accounts, backed by googling; gazapressheroes; AlJazeera; Middle East Eye; AJ Plus; Nick Jackson; KSL News Radio; Elroy Spacely; Dylan.page",Multiple times per day,Fox 13 News Utah; KSL,Weekly,Whatever credible news sources I can find when backing up information I found on TikTok.,Monthly,New York Times; KSL; MSNBC; Fox News; CNN; Washington Post,Weekly,,Less than monthly / Never,,Less than monthly / Never,,Less than monthly / Never
6030ac6fe9ee913af8f49a8f,,Less than monthly / Never,,Less than monthly / Never,,Less than monthly / Never,,Less than monthly / Never,"No specific sources, just tend to view whatever is appearing on the timeline and is part of relevant news.",Daily,"same as last answer, just whatever shows up no specific sources.",Monthly,,Less than monthly / Never,,Less than monthly / Never,,Less than monthly / Never,,Less than monthly / Never
664f408259a7d76b52e2ae25,,Less than monthly / Never,,Less than monthly / Never,,Less than monthly / Never,,Less than monthly / Never,,Less than monthly / Never,"CBS Chicago, new york post",Weekly,,Daily,,Less than monthly / Never,,Less than monthly / Never,,Less than monthly / Never
53a690f1fdf99b606761aacb,,Less than monthly / Never,,Less than monthly / Never,espn sports news; tnt sports; cbs news; abc news,Daily,,Less than monthly / Never,,Less than monthly / Never,penguinz0,Daily,,Less than monthly / Never,,Less than monthly / Never,,Less than monthly / Never,,Less than monthly / Never
605733fb52820cc2a723fea3,,Less than monthly / Never,,Less than monthly / Never,Fox News,Weekly,,Less than monthly / Never,"cotizen free press, laura loomer, dan bongino, Oan tv",Multiple times per day,,Less than monthly / Never,Citizen Free Press,Multiple times per day,Charlie Kirk,Weekly,,Less than monthly / Never,,Less than monthly / Never
5bc2c49f83f9420001011bf8,,Daily,,Weekly,,Weekly,,Weekly,,Multiple times per day,,Multiple times per day,,Multiple times per day,,Weekly,,Less than monthly / Never,,Daily
65eab94c2e93163efc291e8c,,Less than monthly / Never,,Less than monthly / Never,,Less than monthly / Never,,Less than monthly / Never,,Less than monthly / Never,,Less than monthly / Never,,Less than monthly / Never,,Less than monthly / Never,,Less than monthly / Never,,Less than monthly / Never
65e7ab35cc35423acd70bb66,,Less than monthly / Never,,Less than monthly / Never,The Reid Out; Meet the Press; Jen Psaki; Ari Melber,Daily,,Less than monthly / Never,,Less than monthly / Never,,Less than monthly / Never,,Less than monthly / Never,,Less than monthly / Never,,Less than monthly / Never,,Less than monthly / Never
63d53aba8df6735aa2f61e80,Kotv; fox news,Daily,,Less than monthly / Never,,Less than monthly / Never,,Less than monthly / Never,,Less than monthly / Never,,Less than monthly / Never,USA Today; wsj,Weekly,,Less than monthly / Never,,Less than monthly / Never,,Less than monthly / Never
614d465852620924f85603c8,,Less than monthly / Never,,Less than monthly / Never,kake,Monthly,,Less than monthly / Never,,Less than monthly / Never,,Less than monthly / Never,,Less than monthly / Never,,Less than monthly / Never,,Less than monthly / Never,Power93.5,Weekly
5c1a0a74cdd50e00014c7f75,,Less than monthly / Never,,Less than monthly / Never,,Less than monthly / Never,,Less than monthly / Never,,Less than monthly / Never,,Less than monthly / Never,,Less than monthly / Never,,Less than monthly / Never,,Less than monthly / Never,,Less than monthly / Never
65956a01497458176eec78a6,,Less than monthly / Never,,Less than monthly / Never,,Less than monthly / Never,goodmorningbadnews; underthedesknews,Weekly,,Less than monthly / Never,,Less than monthly / Never,New York Post,Daily,,Less than monthly / Never,,Less than monthly / Never,,Less than monthly / Never
66307d20ce5f56b7caec4a27,MSN ,Weekly,,Less than monthly / Never,CNN;MSNBC,Weekly,,Less than monthly / Never,,Less than monthly / Never,MSN ,Monthly,,Less than monthly / Never,,Less than monthly / Never,,Less than monthly / Never,,Less than monthly / Never
664283aa710634eac1e4cdd4,,Less than monthly / Never,,Less than monthly / Never,"MSNBC, meet the press",Daily,Under the News Desk,Daily,,Less than monthly / Never,,Less than monthly / Never,,Less than monthly / Never,,Less than monthly / Never,,Less than monthly / Never,,Less than monthly / Never
662f4b21446b8c3f43f13160,,Less than monthly / Never,"They primarily come from posts reshared on my friend's Instagram accounts - brief infographics, still images of Ukraine or Palestine with a headline superimposed, perhaps a single brief paragraph. I'm not sure of most of the sources however I know some come from @bbcnews; @guardian; @guardian_us",Daily,,Less than monthly / Never,,Less than monthly / Never,,Less than monthly / Never,,Less than monthly / Never,BBC; The Guardian; New York Times; Washington Post; Jacobin,Daily,,Less than monthly / Never,,Less than monthly / Never,,Less than monthly / Never
64d415333022f743dc10a219,Msnbc; friends,Monthly,,Less than monthly / Never,Local News ,Daily,,Less than monthly / Never,,Less than monthly / Never,Rachel Maddow; msnbc,Daily,,Less than monthly / Never,,Less than monthly / Never,Dallas Morning News,Daily,,Less than monthly / Never
5f4fef64fd3fc113300fbb44,,Less than monthly / Never,,Less than monthly / Never,ABC News; NBC Philadelphia,Weekly,,Less than monthly / Never,Reuters; Reading Eagle; BBC; ABC; CNN,Daily,,Less than monthly / Never,Reading Eagle,Monthly,The Economist; Econtalk,Weekly,,Less than monthly / Never,WFMZ,Monthly
5cf7dd949b3f4d0018a798b6,,Less than monthly / Never,,Less than monthly / Never,telemundo and univision,Weekly,,Less than monthly / Never,,Less than monthly / Never,popular videos tab,Weekly,,Less than monthly / Never,,Less than monthly / Never,,Less than monthly / Never,,Less than monthly / Never
6627722f249e56fcefd07b8c,,Less than monthly / Never,,Less than monthly / Never,,Less than monthly / Never,,Less than monthly / Never,,Less than monthly / Never,,Less than monthly / Never,,Less than monthly / Never,,Less than monthly / Never,,Less than monthly / Never,,Less than monthly / Never
601f6a2231a2904b79df1671,,Less than monthly / Never,,Less than monthly / Never,Local news,Weekly,Blake Ross,Monthly,Will Stancil; Jared Holt; Katie Phang; Kyle Griffen; Assigned Media,Daily,Stephen Colbert; CNN; CSpan; ,Daily,Washington Post; Pink News; Huffington Post; New York Times,Monthly,,Less than monthly / Never,,Less than monthly / Never,,Less than monthly / Never
5d1d3f10d5669200017b4e46,News sources on specific issues like Woods Hole Oceanagraphic Institute; conventional news sources shared by friends or suggested by Facebook,Weekly,,Less than monthly / Never,,Less than monthly / Never,,Less than monthly / Never,,Less than monthly / Never,Local news YouTube channels like WRAL; local channels to other places as they are relevant. ,Weekly,Google News aggregator,Daily,,Less than monthly / Never,,Less than monthly / Never,,Less than monthly / Never
638a66471585cb7583285740,,Less than monthly / Never,,Less than monthly / Never,CNN; MSNBC; Local,Multiple times per day,,Less than monthly / Never,No specific source,Weekly,,Less than monthly / Never,New York Times; AP Press; BBC; DrudgeReport,Multiple times per day,,Less than monthly / Never,,Less than monthly / Never,,Less than monthly / Never
62985696ac29368711b54098,,Less than monthly / Never,,Less than monthly / Never,,Less than monthly / Never,,Less than monthly / Never,Abc news;Fox News ; Reuters; Wall Street Journal; NY time; Ny Post Washing Post; The Hill,Monthly,,Less than monthly / Never,Yahoo News ,Daily,,Less than monthly / Never,Pittsburg Morning Sun,Weekly,,Less than monthly / Never
663e191d67a00a79108b7536,,Daily,,Daily,,Less than monthly / Never,,Less than monthly / Never,,Less than monthly / Never,,Less than monthly / Never,,Daily,,Less than monthly / Never,,Less than monthly / Never,,Less than monthly / Never
66359f49052e6688969b252c,,Weekly,,Less than monthly / Never,,Less than monthly / Never,,Less than monthly / Never,,Less than monthly / Never,,Less than monthly / Never,Google News,Multiple times per day,,Less than monthly / Never,,Less than monthly / Never,,Less than monthly / Never
602b341eaa844c268044e8f4,,Less than monthly / Never,The4ckinnews; underthedesknews,Daily,,Less than monthly / Never,,Less than monthly / Never,,Less than monthly / Never,,Less than monthly / Never,,Less than monthly / Never,,Less than monthly / Never,,Less than monthly / Never,,Less than monthly / Never
63d881ab484805569b553bd8,,Less than monthly / Never,explore page,Daily,,Less than monthly / Never,,Less than monthly / Never,BBC,Monthly,home page; bbc,Multiple times per day,BBC,Monthly,,Less than monthly / Never,,Less than monthly / Never,,Less than monthly / Never
5930c7fdfa699e0001017cc1,,Less than monthly / Never,,Less than monthly / Never,,Less than monthly / Never,,Less than monthly / Never,tmz; humanist report,Daily,humanist report,Daily,brave search; google; duck duck go,Daily,,Less than monthly / Never,,Less than monthly / Never,,Less than monthly / Never
5f4c5eda037ed5165232d0a0,"Local police and arrest pages, local pros and cons of the community, meme pages",Multiple times per day,,Less than monthly / Never,"Fox, ABC, Cartoon Network",Monthly,"Pearlmania, daily News, news in 60 seconds",Multiple times per day,,Less than monthly / Never,"The Goons, Soup, McNasty, Blarg, The Dooo",Multiple times per day,"Buzz feeds, Snopes.",Weekly,"The Goons, Joe Rogan",Weekly,Kansas City Star,Monthly,"98.9 The Rock, Mix 93.3, 101.1 The Fox",Daily
65e12b49f5dd69dd609a5eaf,Normally through reels ,Monthly,The Shade Room,Monthly,,Less than monthly / Never,I do not follow anyone in particular I just scroll on my timeline and see different things happening. ,Multiple times per day,,Less than monthly / Never,,Less than monthly / Never,,Less than monthly / Never,,Less than monthly / Never,,Less than monthly / Never,,Less than monthly / Never
663d6f6cf15368bab6c85c33,True Crime Society; Crossroads Today; Death after Dark,Monthly,,Less than monthly / Never,Newscenter 25/Crossroads Today,Monthly,Londons Notebook; The Weather Channel,Daily,,Less than monthly / Never,,Less than monthly / Never,New York Times; The Victoria Advocate,Monthly,,Less than monthly / Never,,Less than monthly / Never,,Less than monthly / Never
5f98c3f8f2d9be1e75e21709,,Less than monthly / Never,,Less than monthly / Never,CBS;NBC;abc;CNN;fox ,Daily,,Less than monthly / Never,,Less than monthly / Never,CBS;NBC;Fox;msnbc,Weekly,Google News;aljazzira;times;,Multiple times per day,The Joe Rogan experience,Weekly,,Less than monthly / Never,,Less than monthly / Never
60901816d52378c69c140607,,Less than monthly / Never,"Online vloggers, Vox",Daily,,Less than monthly / Never,,Less than monthly / Never,"ABC, Fox, CNN, Bloomberg, Forbes, Online reporters and private citizens",Multiple times per day,"ABC, CBS, NBC",Weekly,"Google, online news articles from CBS, ABC, Vox, Forbes, Bloomberg and others",Daily,,Less than monthly / Never,,Less than monthly / Never,,Less than monthly / Never
5dd597c897405455982d1b0c,,Less than monthly / Never,,Less than monthly / Never,,Less than monthly / Never,,Less than monthly / Never,,Less than monthly / Never,,Less than monthly / Never,CNBC;CNN; Newsweek,Weekly,,Less than monthly / Never,,Less than monthly / Never,,Less than monthly / Never
63b5eb0ec316229203f1ddae,,Less than monthly / Never,,Less than monthly / Never,"CNN, CNBC, MSNBC, FOX",Multiple times per day,,Less than monthly / Never,Emptywheel,Multiple times per day,"Indisputable, Meidas",Multiple times per day,TPM; National Review,Multiple times per day,Joe Rogan,Weekly,"NYT, WSJ, WaPo",Multiple times per day,,Less than monthly / Never
664935dfbc503d1bb55d8bb9,"WBSTV (local page), Fox 5, BBC",Weekly,,Less than monthly / Never,,Less than monthly / Never,,Less than monthly / Never,,Less than monthly / Never,,Less than monthly / Never,New York Times ,Weekly,,Less than monthly / Never,,Less than monthly / Never,,Less than monthly / Never
662bd73f5d1ebe5b275d7d5a,,Less than monthly / Never,,Less than monthly / Never,,Less than monthly / Never,,Less than monthly / Never,Alex Becker; Ellios Trades,Daily,,Less than monthly / Never,NBC New; The Guardian; The Washington Post; The Wall Street Journal; NPR; Popular Mechanics; Axios,Multiple times per day,,Less than monthly / Never,,Less than monthly / Never,,Less than monthly / Never
615528d84655a2ab9655a686,,Less than monthly / Never,,Less than monthly / Never,,Less than monthly / Never,,Less than monthly / Never,,Less than monthly / Never,,Less than monthly / Never,,Less than monthly / Never,,Less than monthly / Never,,Less than monthly / Never,,Less than monthly / Never
62e7357284e65421d8f8b10f,Knoxville community page,Daily,,Less than monthly / Never,Cbs news,Daily,,Less than monthly / Never,,Less than monthly / Never,,Less than monthly / Never,"Yahoo, msn",Daily,,Less than monthly / Never,,Less than monthly / Never,,Less than monthly / Never
5f888a84d0200d03067e17ed,BBC,Multiple times per day,,Less than monthly / Never,Fox News ,Multiple times per day,,Less than monthly / Never,Wall Street Journal,Weekly,,Less than monthly / Never,,Less than monthly / Never,,Less than monthly / Never,New York times ,Daily,CNN ,Daily
662e9f8ce011b68bfea886a3,,Daily,,Less than monthly / Never,,Monthly,,Daily,,Less than monthly / Never,,Weekly,,Daily,,Less than monthly / Never,,Less than monthly / Never,,Daily
5df70c5ae69d0a4d623d9cbf,,Less than monthly / Never,,Less than monthly / Never,,Less than monthly / Never,,Less than monthly / Never,,Less than monthly / Never,,Less than monthly / Never,,Less than monthly / Never,,Less than monthly / Never,,Less than monthly / Never,,Less than monthly / Never
63faeccd22c0d2a8f1b9759e,,Less than monthly / Never,The Shade Room and Hollywood Unlocked,Daily,,Less than monthly / Never,,Less than monthly / Never,Twitter/X feeds,Weekly,"CNN, MSNBC, Commentators, The View, The Breakfast Club",Daily,,Less than monthly / Never,,Less than monthly / Never,,Less than monthly / Never,,Less than monthly / Never
6644b3220306190645b734f2,,Weekly,,Less than monthly / Never,Fox news,Monthly,,Weekly,,Less than monthly / Never,,Multiple times per day,,Weekly,,Weekly,,Less than monthly / Never,,Daily
5563b68afdf99b672cca50d3,,Less than monthly / Never,,Less than monthly / Never,Fox 40,Daily,,Less than monthly / Never,Ny Post; Wall Street Journal; BBC,Multiple times per day,Various clips no specific channels.,Multiple times per day,"BBC.com; WSJ.com; NYPost.com; NewYorkTimes; LATimes, Sacbee.com",Multiple times per day,BBC; NPR,Multiple times per day,Wall Street Journal; Sacramento Bee,Daily,,Less than monthly / Never
65a245b76f17beac9e7e32fe,,Less than monthly / Never,,Less than monthly / Never,,Less than monthly / Never,,Less than monthly / Never,BBC News; TMZ; WHO; United Nations; MSNBC; Hasanabi,Multiple times per day,,Less than monthly / Never,,Less than monthly / Never,,Less than monthly / Never,,Less than monthly / Never,,Less than monthly / Never
614f58258eaf7063aa888d90,,Less than monthly / Never,hyperallergic; al jazeera; artnews,Weekly,,Less than monthly / Never,,Less than monthly / Never,,Less than monthly / Never,,Less than monthly / Never,cnn.com; bbc.com; aljazeera.com; theguardian.com,Weekly,,Less than monthly / Never,,Less than monthly / Never,,Less than monthly / Never
662ed97e23a6d55bb855adae,,Less than monthly / Never,,Less than monthly / Never,fox news,Monthly,,Less than monthly / Never,,Less than monthly / Never,,Less than monthly / Never,,Less than monthly / Never,,Less than monthly / Never,,Less than monthly / Never,,Less than monthly / Never
6630f3dfb4d49b3bbb2b8778,,Less than monthly / Never,,Less than monthly / Never,Breaking Points; Democracy Now,Weekly,,Less than monthly / Never,Zero Hedge; Eric Feigl Ding; Krystal Ball; Danielle Dimartino Booth,Daily,Breaking Points; Fox News; Kim Iverson; Democracy Now; Yvette Carnell; Charles Payne,Multiple times per day,,Less than monthly / Never,Joe Rogan; Lex Friedman,Daily,,Less than monthly / Never,NPR,Monthly
6630f618f66e307e78fc37d3,,Less than monthly / Never,"None that I follow, some are sponsored or in my ""for you"". Usually about companies or sports/games",Daily,,Less than monthly / Never,,Less than monthly / Never,Usually some tech or finance accounts that randomly pop up,Weekly,ABC; NPR; food channels,Daily,ABC; AP; NPR,Weekly,,Less than monthly / Never,,Less than monthly / Never,,Less than monthly / Never
65c111f100af1af81e3f444d,,Less than monthly / Never,,Less than monthly / Never,,Less than monthly / Never,,Less than monthly / Never,,Less than monthly / Never,cbs; abc,Monthly,,Less than monthly / Never,hasanabi (twitch),Daily,,Less than monthly / Never,,Less than monthly / Never
56c89222dfea6c000bb23762,abc;msnbc;fox;cnn,Daily,,Less than monthly / Never,local news,Daily,specific news hashtags; al jazeera; white house,Daily,al jazeera; new york times; the economist;associated press,Multiple times per day,,Less than monthly / Never,new york times; substack; reddit,Monthly,democracy now; chapo traphouse,Weekly,,Less than monthly / Never,,Less than monthly / Never
6637658076f2795a44c9800b,,Multiple times per day,,Multiple times per day,,Daily,,Multiple times per day,,Multiple times per day,,Daily,,Daily,,Daily,,Daily,,Daily
62dbcc6f4bb8a5fd4c24da09,,Less than monthly / Never,,Less than monthly / Never,,Less than monthly / Never,,Less than monthly / Never,,Less than monthly / Never,,Weekly,,Daily,,Less than monthly / Never,,Less than monthly / Never,,Less than monthly / Never
5bc5552a23ecbb00012d6cb5,,Less than monthly / Never,,Less than monthly / Never,"Fox and Friends, The Five, KTEN news",Multiple times per day,,Less than monthly / Never,,Less than monthly / Never,,Less than monthly / Never,,Less than monthly / Never,,Less than monthly / Never,,Less than monthly / Never,,Less than monthly / Never
5995be89f9db7d0001895993,ION Tampa; WFLA.com; Dunedin Patch; TampaBayTimes ,Daily,,Less than monthly / Never,CBS Nightly News; WFLA,Daily,,Less than monthly / Never,WFLA,Daily,,Less than monthly / Never,NYT.com;WallStreetJurnal.com;NPR.com;APNews.com,Multiple times per day,,Less than monthly / Never,,Less than monthly / Never,,Less than monthly / Never
62bd2a704c56e669cce7ce56,The news that my friends and family post.,Daily,,Less than monthly / Never,MSNBC,Weekly,,Less than monthly / Never,Whatever shows up in my Twitter feed.,Weekly,,Less than monthly / Never,Google News,Daily,Joe Rogan,Weekly,Local city newspaper,Monthly,Local radio stations,Weekly
607f7f18d84d010ea2cd8664,Fox news; kfyr,Multiple times per day,,Less than monthly / Never,Fox News; Local News,Weekly,,Less than monthly / Never,,Less than monthly / Never,Fox news ; Local news; global news,Daily,new york times; fox news; huffington post,Weekly,,Less than monthly / Never,,Less than monthly / Never,,Less than monthly / Never
5edb7d4bb27be27fdc6e973a,,Less than monthly / Never,,Less than monthly / Never,,Less than monthly / Never,"Pearlmania500, Under the Desk News",Multiple times per day,,Less than monthly / Never,,Less than monthly / Never,,Less than monthly / Never,,Less than monthly / Never,,Less than monthly / Never,,Less than monthly / Never
57c725d89a5f4f0001f661bd,,Less than monthly / Never,,Less than monthly / Never,,Less than monthly / Never,,Less than monthly / Never,,Less than monthly / Never,,Less than monthly / Never,Google News,Daily,,Less than monthly / Never,Daily Astorian,Monthly,,Less than monthly / Never
5cf5134c8f8ff80019e76721,,Less than monthly / Never,,Less than monthly / Never,"MSNBC, NBC, local news",Multiple times per day,,Less than monthly / Never,,Less than monthly / Never,,Less than monthly / Never,Google new;New York Times,Multiple times per day,,Less than monthly / Never,,Less than monthly / Never,,Less than monthly / Never
