PROLIFIC_PID,Facebook,Facebook_freq,Instagram,Instagram_freq,TV news programs,TV news programs_freq,TikTok,TikTok_freq,Twitter/X,Twitter/X_freq,YouTube,YouTube_freq,online news sites,online news sites_freq,podcasts,podcasts_freq,printed newspapers,printed newspapers_freq,the radio,the radio_freq
6631946e4f43db45004ae20e,CNN,Multiple times per day,,Less than monthly / Never,CNN; The New York times,Daily,,Less than monthly / Never,"CNN, fox news",Weekly,,Less than monthly / Never,New York sun; News4 Max,Weekly,,Less than monthly / Never,Free Times; the sun news,Monthly,South Carolina Public Radio,Daily
66243beaf0099d1649a7a137,,Less than monthly / Never,,Less than monthly / Never,,Less than monthly / Never,,Less than monthly / Never,,Less than monthly / Never,,Less than monthly / Never,,Less than monthly / Never,,Less than monthly / Never,,Less than monthly / Never,,Less than monthly / Never
64661aae76600e457f232501,,Less than monthly / Never,,Less than monthly / Never,,Less than monthly / Never,,Less than monthly / Never,,Less than monthly / Never,,Monthly,1440,Daily,,Less than monthly / Never,,Less than monthly / Never,,Less than monthly / Never
64f1f404809fb79511978ea5,,Less than monthly / Never,,Less than monthly / Never,,Less than monthly / Never,,Less than monthly / Never,,Less than monthly / Never,,Less than monthly / Never,CNN: NPR: Google Search then going to top searches: Guardian: Atlantic: Reddit,Weekly,,Less than monthly / Never,,Less than monthly / Never,,Less than monthly / Never
65172fc7765bc8a93b141b68,CNN,Weekly,,Less than monthly / Never,CNN; BBC; AJAZEERA; ,Daily,,Less than monthly / Never,CNN; BBC,Weekly,The Daily Show,Weekly,,Less than monthly / Never,,Less than monthly / Never,,Less than monthly / Never,,Less than monthly / Never
61bb396840db417c1a138e3d,,Less than monthly / Never,,Less than monthly / Never,,Less than monthly / Never,,Less than monthly / Never,,Daily,,Less than monthly / Never,,Weekly,NPR one,Weekly,,Less than monthly / Never,NPR,Weekly
663bfec995e1af340b6f0882,,Weekly,Some good news,Monthly,,Weekly,,Weekly,,Less than monthly / Never,,Less than monthly / Never,,Less than monthly / Never,,Less than monthly / Never,,Less than monthly / Never,,Less than monthly / Never
58509fbda6946500016117ed,,Less than monthly / Never,,Less than monthly / Never,CNN; WTHR; RTV6,Weekly,,Less than monthly / Never,,Less than monthly / Never,Daily Show; Local News Highlights,Daily,Drudge Report; Reddit; Cnn.com,Multiple times per day,The Daily - New York Times; NPR News Now,Daily,,Less than monthly / Never,,Less than monthly / Never
633c54f0ed8068d46acd8f68,,Daily,,Less than monthly / Never,,Weekly,,Less than monthly / Never,,Less than monthly / Never,,Multiple times per day,,Daily,,Multiple times per day,,Less than monthly / Never,,Daily
5eb693937a030e5923b44068,,Multiple times per day,,Multiple times per day,,Weekly,,Daily,,Daily,,Daily,,Daily,,Weekly,,Weekly,,Weekly
655cc974613aec120f21293b,,Daily,,Multiple times per day,,Weekly,,Multiple times per day,,Daily,,Multiple times per day,,Daily,,Daily,,Weekly,,Weekly
5a6c8047e70ca900017acdae,,Less than monthly / Never,,Less than monthly / Never,NBC,Weekly,,Less than monthly / Never,,Less than monthly / Never,,Less than monthly / Never,"NPR, NYTimes",Monthly,,Less than monthly / Never,,Less than monthly / Never,NPR,Weekly
6649e8a544b93b46628a2638,"Fox, CNN, NPR",Multiple times per day,,Less than monthly / Never,"FoxNews, CNN",Weekly,,Less than monthly / Never,"Various pages, Fox, CNN, NPR",Multiple times per day,"Fox, CNN, NPR, Guardian, Telegraph",Multiple times per day,"Fox, CNN, NPR, MSNBC",Multiple times per day,,Less than monthly / Never,Arkansas Democrat Gazette,Monthly,NPR,Multiple times per day
6572217dd7539bb1cd4704ff,,Less than monthly / Never,,Less than monthly / Never,kcal news,Daily,,Less than monthly / Never,,Less than monthly / Never,,Less than monthly / Never,cnn.com;newsbreak,Daily,,Less than monthly / Never,,Less than monthly / Never,,Less than monthly / Never
5e0f443e8205266652153f5e,,Less than monthly / Never,"no specific accounts, i just look through the discover page",Multiple times per day,cnn; abc; stephen colbert show,Weekly,,Less than monthly / Never,no specific accounts,Daily,no specific accounts that I can recall,Multiple times per day,cnn; bbc; nbcnews; vox,Daily,,Less than monthly / Never,,Less than monthly / Never,,Less than monthly / Never
65600aa7ff0c0fcf0ddcda34,,Less than monthly / Never,,Less than monthly / Never,CBS evening news,Monthly,,Less than monthly / Never,,Less than monthly / Never,The quartering; Brad Polumbo,Daily,"New York Times; CNN, Fox News",Multiple times per day,,Less than monthly / Never,,Less than monthly / Never,,Less than monthly / Never
5e8b9c7054a5cc07dd6e174d,,Less than monthly / Never,,Less than monthly / Never,NBC Nightly News; local TV news,Daily,,Less than monthly / Never,,Less than monthly / Never,David Pakman,Weekly,Political Wire; CNN; Google News,Daily,David Pakman,Daily,,Less than monthly / Never,,Less than monthly / Never
648868ab86c65ebe29777662,,Less than monthly / Never,,Less than monthly / Never,,Less than monthly / Never,,Less than monthly / Never,,Less than monthly / Never,,Less than monthly / Never,,Less than monthly / Never,,Less than monthly / Never,Evansville Courier; Posey County News,Daily,WIKY,Multiple times per day
60f989f2b726f86c3d24e13e,"CNN, BBC News, ABC World News, Fox News",Multiple times per day,"CNN, Fox News",Weekly,"CNN, BBC News, NBC Nightly News, ABC World News Tonight, CBS Evening News, Fox News",Daily,,Less than monthly / Never,"CNN, BBC News, Fox News",Monthly,"The New York Times, CNN",Daily,"The New York Times, USA Today",Weekly,,Less than monthly / Never,"The New York Times,  The Wall Street Journal,  USA Today",Daily,,Less than monthly / Never
5e84f020507cd30b367b2624,,Less than monthly / Never,,Less than monthly / Never,,Less than monthly / Never,,Less than monthly / Never,,Less than monthly / Never,,Less than monthly / Never,"NY Times, BBC, Hiff Post, MSNBC, Politico",Multiple times per day,,Less than monthly / Never,NY Times,Monthly,"NPR, Bloomberg",Weekly
662ffc4bf3d9a68a45709788,"Wall Street, cnn, bbc, Al Jazeera ",Multiple times per day,"Cnn, bbc",Weekly,"Cnn, bbc, Al Jazeera, cnbc, msnbc",Multiple times per day,,Less than monthly / Never,"Cnn, bbc, aljazeera ",Daily,"Bbc, cnn aljazeera ",Weekly,,Less than monthly / Never,,Less than monthly / Never,,Less than monthly / Never,"Rock101, wevh, wevo",Weekly
63bc0a007b1c348dff56b59d,,Weekly,,Less than monthly / Never,,Less than monthly / Never,,Less than monthly / Never,,Less than monthly / Never,,Less than monthly / Never,,Weekly,,Less than monthly / Never,,Less than monthly / Never,,Less than monthly / Never
648646988a5170373da06a9e,,Less than monthly / Never,,Less than monthly / Never,CNN; ABC,Weekly,,Less than monthly / Never,,Less than monthly / Never,,Less than monthly / Never,CNN,Multiple times per day,,Less than monthly / Never,,Less than monthly / Never,,Less than monthly / Never
5e34325430e5263f0bebb32d,,Less than monthly / Never,,Less than monthly / Never,,Less than monthly / Never,,Less than monthly / Never,,Less than monthly / Never,MSNBC; CNN,Daily,Flipboard; BBC,Daily,Rachel Maddow,Monthly,,Less than monthly / Never,,Less than monthly / Never
5f48e9e36d9c7b3b69c5ed4f,,Less than monthly / Never,,Less than monthly / Never,CNN;Fox News,Weekly,,Less than monthly / Never,,Less than monthly / Never,,Less than monthly / Never,CNN;Fox News;MSN,Daily,,Less than monthly / Never,,Less than monthly / Never,,Less than monthly / Never
657b0da1a8bd5027b9c32bd5,,Less than monthly / Never,,Less than monthly / Never,local tv channels,Weekly,,Less than monthly / Never,,Less than monthly / Never,,Less than monthly / Never,,Weekly,,Less than monthly / Never,,Less than monthly / Never,local throwbacks stations,Monthly
65a2754be2b9a23db776760e,,Weekly,,Weekly,,Weekly,,Daily,,Daily,,Daily,,Weekly,,Daily,,Less than monthly / Never,,Less than monthly / Never
586371807fbbcd00013972ad,Facebook feed,Monthly,,Less than monthly / Never,,Less than monthly / Never,,Less than monthly / Never,Discord/forum links,Weekly,Discord/forum links,Weekly,Discord/forum links,Weekly,,Less than monthly / Never,,Less than monthly / Never,,Less than monthly / Never
664167adcaa569ada842f8de,,Less than monthly / Never,,Less than monthly / Never,,Less than monthly / Never,,Less than monthly / Never,,Less than monthly / Never,Black scout survival; Canadian prepper; fox,Multiple times per day,,Less than monthly / Never,,Less than monthly / Never,,Less than monthly / Never,,Less than monthly / Never
5de831cad4995d000c5fb540,,Less than monthly / Never,,Less than monthly / Never,,Less than monthly / Never,,Less than monthly / Never,,Less than monthly / Never,,Less than monthly / Never,Citizenfreepress.xom,Multiple times per day,,Less than monthly / Never,,Less than monthly / Never,Bongino,Monthly
5b6259be5256470001bd0c6d,,Less than monthly / Never,,Less than monthly / Never,"Fox News, BlazeTV",Monthly,,Less than monthly / Never,Elon Musk;Radar Online;Jack Posobiec,Weekly,Financial Education;BlazeTV;Better Bachelor,Daily,,Less than monthly / Never,,Less than monthly / Never,,Less than monthly / Never,,Less than monthly / Never
5c110067753adc00015913e3,,Less than monthly / Never,,Less than monthly / Never,Local CBS news,Daily,"Governor DeSantis,",Multiple times per day,,Less than monthly / Never,,Less than monthly / Never,Fox news,Monthly,,Less than monthly / Never,,Less than monthly / Never,,Less than monthly / Never
5eb9c4677644a30f4084e6b0,,Less than monthly / Never,,Less than monthly / Never,,Less than monthly / Never,,Less than monthly / Never,,Less than monthly / Never,,Less than monthly / Never,,Less than monthly / Never,,Less than monthly / Never,,Less than monthly / Never,,Less than monthly / Never
5e6940a5960d3606dda9c2b7,,Less than monthly / Never,,Less than monthly / Never,"CNN, Local Station 13",Daily,,Less than monthly / Never,scott maxwell,Monthly,The Daily Show,Weekly,BBC news: ,Weekly,Pod Save America: Ralph Nader Radio Hour,Weekly,"Orlando Sentinel, Orlando Weekly",Weekly,NPR,Daily
60de1b2645c3c7c864f4a89d,,Less than monthly / Never,,Less than monthly / Never,,Less than monthly / Never,,Less than monthly / Never,,Less than monthly / Never,Philip Defranco; Fox news; Bloomberg televison; Cnbc,Multiple times per day,New york times,Monthly,,Less than monthly / Never,,Less than monthly / Never,,Less than monthly / Never
63a4af8f8b8722876fa88952,Trafford Borough Group,Weekly,,Less than monthly / Never,,Less than monthly / Never,,Less than monthly / Never,,Less than monthly / Never,,Less than monthly / Never,Newsbreak app,Multiple times per day,,Less than monthly / Never,,Less than monthly / Never,,Less than monthly / Never
651c2cc23704dc10500ae77c,,Less than monthly / Never,,Less than monthly / Never,ABC,Daily,,Less than monthly / Never,,Less than monthly / Never,MSNBC:Medias,Multiple times per day,,Less than monthly / Never,Morning Joe; Deadline Whitehouse; Rachel Maddow; 11th Hour,Daily,,Less than monthly / Never,,Less than monthly / Never
5ef54b31234db61ac1c7fdb0,,Less than monthly / Never,,Less than monthly / Never,,Less than monthly / Never,,Less than monthly / Never,I just search on Google and read tweets when they are relevant to a major news story especially by Biden or obama,Monthly,I pay attention to MSNBC clips and major commentators from NBC news,Multiple times per day,"Google news aggregator, New York times, cnn",Multiple times per day,I listen to some science news with Sabine and others,Weekly,,Less than monthly / Never,"Krab radio, woody show, ",Daily
5fc59fed16726c1191d1172f,Fox 25 Boston: WCBV Boston,Daily,,Less than monthly / Never,Local news outlets Fox 25 Boston,Daily,,Less than monthly / Never,Fall river Reporter:Fox 25 Boston,Weekly,,Less than monthly / Never,Fox 25 Boston: WCBV channel 5 Boston,Daily,,Less than monthly / Never,,Less than monthly / Never,,Less than monthly / Never
63c06106314da889290931cd,,Less than monthly / Never,,Less than monthly / Never,NBC,Multiple times per day,,Less than monthly / Never,,Less than monthly / Never,,Less than monthly / Never,google,Daily,,Less than monthly / Never,Indy Star,Weekly,KLove,Multiple times per day
6606d127f34ea525192db1b2,,Less than monthly / Never,,Less than monthly / Never,,Less than monthly / Never,,Less than monthly / Never,,Less than monthly / Never,,Less than monthly / Never,google news stories;reddit,Monthly,,Less than monthly / Never,,Less than monthly / Never,,Less than monthly / Never
63b6c18f4f13282703357493,Shares from friends,Multiple times per day,Advertisements,Monthly,CNN,Weekly,,Less than monthly / Never,,Less than monthly / Never,Fox,Monthly,Yahoo,Daily,Box of Oddities,Monthly,,Less than monthly / Never,97.9,Daily
65eaee94a1826098aae0eb95,,Less than monthly / Never,,Less than monthly / Never,,Less than monthly / Never,,Less than monthly / Never,,Less than monthly / Never,,Less than monthly / Never,AP News,Daily,,Less than monthly / Never,,Less than monthly / Never,,Less than monthly / Never
614f6bad672ef7cf5ecfd965,,Less than monthly / Never,,Less than monthly / Never,CNN; CBS; pbs,Daily,,Less than monthly / Never,,Less than monthly / Never,nasaspaceflight; Scott Manely;,Monthly,ap; CNN; new York times; rueters,Daily,,Less than monthly / Never,,Less than monthly / Never,,Less than monthly / Never
63d5daa80d80a745de740c13,,Less than monthly / Never,,Less than monthly / Never,Fox news,Daily,,Less than monthly / Never,,Less than monthly / Never,Fox news,Daily,Cape cod times ; Yahoo news,Daily,,Less than monthly / Never,,Less than monthly / Never,,Less than monthly / Never
645cdd7e6f92e0c2aea92281,,Less than monthly / Never,,Less than monthly / Never,,Less than monthly / Never,,Less than monthly / Never,,Less than monthly / Never,,Less than monthly / Never,The New York times,Daily,,Less than monthly / Never,,Less than monthly / Never,,Less than monthly / Never
65f48503f9b5e6a629ba03c8,Posts and ads ,Multiple times per day,,Less than monthly / Never,Local and national news channels ,Multiple times per day,,Less than monthly / Never,,Less than monthly / Never,Scrolling through different channels ,Weekly,,Less than monthly / Never,Searching various podcasts ,Monthly,,Less than monthly / Never,WGRC,Daily
66043185681ea0b36d451b01,,Less than monthly / Never,"CNN, MSNBC, CNBC, NowThis, The Grio, Earn Your Leisure, TallGuyTycoon, Wealth, The Shaderoom. Hollywood Unlocked (Shamefully)",Multiple times per day,"CNN, CNBC, NEWS NATION, LOCAL NEWS",Multiple times per day,No specific accounts- mostly the For You Page and the top videos after I enter in a search on a topic,Multiple times per day,"No accounts specifically, mostly just looking at the trending topics and top discussed occurences.",Multiple times per day,No specific accounts- mostly the top watched video based on whatever search I enter. ,Multiple times per day,"CNN, CNBC, WSBTV",Multiple times per day,No specific accounts. I'll check out a topic or live now and then on whatever my interests are at the time. ,Weekly,,Less than monthly / Never,,Less than monthly / Never
630663a1dc842dde6b18b557,,Less than monthly / Never,,Less than monthly / Never,,Less than monthly / Never,,Less than monthly / Never,,Less than monthly / Never,,Less than monthly / Never,CNN; politico; Yahoo news,Multiple times per day,POD Save America; Bulwark; Amicus,Multiple times per day,,Less than monthly / Never,,Less than monthly / Never
662968da472630cacc819092,,Less than monthly / Never,,Less than monthly / Never,,Less than monthly / Never,MSNBC ,Daily,,Less than monthly / Never,,Less than monthly / Never,,Less than monthly / Never,,Less than monthly / Never,,Less than monthly / Never,,Less than monthly / Never
60fdf01326f76cc0c5be3d2f,,Less than monthly / Never,,Less than monthly / Never,"abc, nbc, cbs",Monthly,,Weekly,,Multiple times per day,,Weekly,,Less than monthly / Never,,Less than monthly / Never,"NYT, newsday. new york post",Weekly,,Less than monthly / Never
62ed458d61ebd1930833e95a,,Less than monthly / Never,,Less than monthly / Never,"cbs news, msnbc and cnn shows",Multiple times per day,,Less than monthly / Never,,Less than monthly / Never,,Less than monthly / Never,"new york times, washington post, politico, axios",Multiple times per day,,Less than monthly / Never,,Less than monthly / Never,,Less than monthly / Never
6642737ce276cfb3c5037d2d,I can't recall right now and my Facebook is currently deactivated.,Monthly,,Less than monthly / Never,,Less than monthly / Never,,Less than monthly / Never,,Less than monthly / Never,Some More News; Last Week Tonight,Monthly,Washington Post; New York Times; The Atlantic; NPR; BBC; Reuters,Multiple times per day,NPR; New York Times; Today Explained (Vox); Armchair Anonymous; Behind the Bastards; Some More News; American Hysteria; You're Wrong About,Weekly,,Less than monthly / Never,,Less than monthly / Never
5d62b2186f363200168bbb85,,Less than monthly / Never,,Less than monthly / Never,WAPT morni g news,Daily,,Less than monthly / Never,,Less than monthly / Never,,Less than monthly / Never,"NY Times, Washington Post, Politico",Monthly,,Less than monthly / Never,,Less than monthly / Never,NPR,Daily
5f4f9bc1f7598f06b2dc816f,,Less than monthly / Never,,Less than monthly / Never,ABC News,Daily,,Less than monthly / Never,,Less than monthly / Never,,Less than monthly / Never,CNBC : CNN,Monthly,,Less than monthly / Never,,Less than monthly / Never,,Less than monthly / Never
63d68e4f60c155f4f1fd9681,,Less than monthly / Never,,Less than monthly / Never,CBS evening news,Weekly,,Less than monthly / Never,Fox; CNN,Daily,,Less than monthly / Never,New York times; NBC; CBS; CNN,Daily,,Less than monthly / Never,,Less than monthly / Never,,Less than monthly / Never
65ca25d9495bbd05f7fbfb6c,,Less than monthly / Never,,Less than monthly / Never,,Less than monthly / Never,,Less than monthly / Never,,Less than monthly / Never,Lastweektonight,Monthly,,Less than monthly / Never,Freakonomics,Weekly,,Less than monthly / Never,,Less than monthly / Never
62dc587c7c0dd665ce6c299c,,Less than monthly / Never,,Less than monthly / Never,"CNN, MSNBC",Monthly,Random accounts - I stumble across news-related content rather than seeking it out through specific accounts,Multiple times per day,NY Times; Washington Post; individual reporter accounts,Multiple times per day,Some More News; Last Week Tonight; Daily Show;,Multiple times per day,NY Times; CNN,Daily,Sam Harris Podcast,Monthly,Nashville Scene,Monthly,,Less than monthly / Never
5cd5e9a49b427c00012af2d1,Lean Left; The Progressive Podunk,Daily,,Less than monthly / Never,,Less than monthly / Never,,Less than monthly / Never,,Less than monthly / Never,"Last Week Tonight (John Oliver); Trae Crowder; VICE; Late Night with Seth Meyers, Tennessee Brando; The Late Show with Stephen Colbert; Grunge; Weekly Skews; CBC News; David Pakman; Meidas Touch; PBS NewsHour; CBS News; Brian Tyler Cohen; BBC; CNN, Sky News; Reuters; Washington Post; Associated Press; Guardian News; BBC News; USA Today; Slate; NPR; Beau of the Fifth Column; CBS Evening News; MSNBC; We Act Radio; The Humanist Report, The Rational National; The Majority Report with Sam Seder",Daily,,Less than monthly / Never,,Less than monthly / Never,,Less than monthly / Never,,Less than monthly / Never
5e42fc295135b5000cd20d0b,"fox, local news group, ",Multiple times per day,,Less than monthly / Never,"Fox, MSNBC",Weekly,,Less than monthly / Never,,Less than monthly / Never,,Less than monthly / Never,fox news; MSNBC; ,Daily,,Less than monthly / Never,,Less than monthly / Never,"local radio station, Amazon music, spotify",Daily
62f6e81d42e7c4dea045f2fc,,Less than monthly / Never,Them; Saint Hoax,Daily,,Less than monthly / Never,,Less than monthly / Never,"Pop Crave; Vanity Fair; Vogue; Jim Acosta, ",Daily,Just Trish; H3 Podcast; Humanist Report; ,Multiple times per day,,Less than monthly / Never,H3 Podcast; Just Trish; Osbournes; PKMN Podcast,Weekly,,Less than monthly / Never,,Less than monthly / Never
6307bd3bb93e804d22332b3e,,Less than monthly / Never,"its just on my scrolling feed, not sure of who posts it",Weekly,wbko(local news),Weekly,top stories ,Daily,,Less than monthly / Never,phillip defranco,Daily,reddit,Multiple times per day,,Less than monthly / Never,,Less than monthly / Never,,Less than monthly / Never
661d0b257a28a596c60285c5,ads on facebook,Weekly,ads or what people share on their story,Monthly,,Less than monthly / Never,if it comes up on my for you page,Weekly,espn news ,Weekly,,Less than monthly / Never,,Less than monthly / Never,,Less than monthly / Never,,Less than monthly / Never,,Less than monthly / Never
5eac8b777b60c8129709fc10,,Less than monthly / Never,,Less than monthly / Never,,Less than monthly / Never,,Less than monthly / Never,,Less than monthly / Never,,Less than monthly / Never,MSN,Weekly,,Less than monthly / Never,,Less than monthly / Never,,Less than monthly / Never
6332274d72eff2df47171a78,,Less than monthly / Never,,Less than monthly / Never,,Less than monthly / Never,,Less than monthly / Never,,Less than monthly / Never,,Less than monthly / Never,Media-ite; The Hill; Politico; Raw Story; Axios; ABC News; MSN News (aggregated from start page),Daily,,Less than monthly / Never,,Less than monthly / Never,,Less than monthly / Never
5588b04ffdf99b7a91e75ddb,I have no favorite source since I rarely use Facebook for news however I do occassionally do searchers on topics to scan what is available but I do not use a specific source on Facebook,Weekly,,Less than monthly / Never,,Less than monthly / Never,,Less than monthly / Never, Matt Wallace @MattWallace888; Figen @TheFigen_; Dom Lucre | Breaker of Narratives @dom_lucre; Catturd ™ @catturd2; Censored Men @CensoredMen;Wide Awake Media @wideawake_media; Wall Street Apes @WallStreetApes; Not Jerome Powell @alifarhat79; Joe Rogan Podcast @joeroganhq;  Game of Trades @GameofTrades_; Jewish Voice for Peace @jvplive ,Multiple times per day,"breaking points, cnn, bloomberg, george galloway, scott ritter, breaking points, joe rogan experience, mahmood od, the rubin report, double down news, steve adubato",Daily,,Less than monthly / Never,,Less than monthly / Never,,Less than monthly / Never,,Less than monthly / Never
5c747b0f181ad300113363ed,,Less than monthly / Never,,Less than monthly / Never,,Less than monthly / Never,,Less than monthly / Never,,Less than monthly / Never,,Less than monthly / Never,Huffington Post,Daily,,Less than monthly / Never,,Less than monthly / Never,,Less than monthly / Never
622ab357bb3af819f2e5df3b,Fox 5 local news; KTLA Los Angeles,Daily,,Less than monthly / Never,ABC News; Local ABC News; CNN,Multiple times per day,,Less than monthly / Never,,Less than monthly / Never,Fox National and Fox 5 local news; KTLA Los Angeles news,Daily,WSJ; New York Times; Yahoo News; People,Multiple times per day,,Less than monthly / Never,Las Vegas Review Journal; New York Times,Daily,,Less than monthly / Never
6334b0fc574064de4e68f578,,Less than monthly / Never,,Less than monthly / Never,,Less than monthly / Never,,Less than monthly / Never,,Less than monthly / Never,,Less than monthly / Never,,Less than monthly / Never,,Less than monthly / Never,,Less than monthly / Never,wtmj radio,Daily
5c670a430d80fd00014264f9,,Less than monthly / Never,,Less than monthly / Never,,Less than monthly / Never,,Less than monthly / Never,,Less than monthly / Never,,Less than monthly / Never,CNN; MSNBC,Daily,,Less than monthly / Never,,Less than monthly / Never,,Less than monthly / Never
61bb396b40db417c1a138e43,,Less than monthly / Never,,Less than monthly / Never,ABC World news,Weekly,,Less than monthly / Never,,Less than monthly / Never,,Less than monthly / Never,yahoo.com,Daily,,Less than monthly / Never,,Less than monthly / Never,,Less than monthly / Never
5ec5a64c306f255ec98d5cc1,,Less than monthly / Never,,Less than monthly / Never,,Less than monthly / Never,,Less than monthly / Never,,Less than monthly / Never,,Less than monthly / Never,Msn; CNN,Daily,,Less than monthly / Never,,Less than monthly / Never,,Less than monthly / Never
566a4cf27da0350012b4582d,,Less than monthly / Never,,Less than monthly / Never,,Less than monthly / Never,,Less than monthly / Never,Disclose.tv; Nicholas J Fuentes; Syrian Girl; The Sentinel,Multiple times per day,,Less than monthly / Never,,Less than monthly / Never,Therightstuff.biz; Warstrike; Amren Radio,Daily,,Less than monthly / Never,,Less than monthly / Never
630f4a2fbeb1ef155037ad1d,,Less than monthly / Never,,Less than monthly / Never,Fox news,Weekly,,Less than monthly / Never,CNN BREAKING NEWS;BBC BREAKING NEWS;FOX NEWS,Multiple times per day,WTOL11;KTLA5;ABC7;KPTVFOX,Multiple times per day,Fox News;CNN;BBC,Weekly,,Less than monthly / Never,,Less than monthly / Never,,Less than monthly / Never
5eb080ccaf87d11143472477,WLKY; WAVE 3; WDRB,Daily,,Less than monthly / Never,Fox News,Weekly,"simple passive scrolling, what's trending will pop into the feed.",Multiple times per day,HASHTAGS,Weekly,Law and Crime,Weekly,New York Post; Washington Post,Monthly,,Less than monthly / Never,Kentucky Standard,Monthly,,Less than monthly / Never
5fe49a4ad8918ba1615e298d,,Less than monthly / Never,,Less than monthly / Never,ABC nightly news; WAPT news,Multiple times per day,,Less than monthly / Never,,Less than monthly / Never,,Less than monthly / Never,CNN; FOX News,Daily,Morning edition ,Daily,The Clarion Ledger ,Weekly,,Less than monthly / Never
641363233e3398da82fcb757,,Less than monthly / Never,,Less than monthly / Never,,Less than monthly / Never,CNN; MSNBC; NPR; BCC; Underthedesknews,Multiple times per day,,Less than monthly / Never,,Less than monthly / Never,BCC; NPR; ABCnews,Monthly,,Less than monthly / Never,,Less than monthly / Never,,Less than monthly / Never
